{
  "$schema": "https://json-schema.org/draft/2020-12/schema",
  "title": "GroundMesh Light Node Result Feed",
  "type": "object",
  "required": [
    "protocol_version",
    "updated_utc",
    "results"
  ],
  "properties": {
    "protocol_version": {
      "type": "string",
      "const": "gm.node.v1"
    },
    "updated_utc": {
      "type": "string",
      "format": "date-time"
    },
    "published_by": {
      "type": "string"
    },
    "node_id": {
      "type": "string",
      "pattern": "^node-[a-z0-9-]{4,64}$"
    },
    "source_path": {
      "type": "string"
    },
    "results": {
      "type": "array",
      "items": {
        "$ref": "node_assignment_result.schema.json"
      }
    }
  },
  "additionalProperties": false
}
